{
  "schema_version": 1,
  "target_date": "2026-08-12",
  "generated_at": "2026-08-11T09:42:55.618174+00:00",
  "counts": {
    "source_request_count": 3,
    "adopted_source_count": 103,
    "duplicate_source_request_count": 0,
    "cache_hit_count": 0,
    "discovery_candidate_count": 96,
    "stage1_candidate_count": 0,
    "stage1_rejected_count": 0,
    "stage2_candidate_count": 0,
    "stage2_completed_count": 0,
    "stage2_unavailable_count": 0,
    "stage2_incomplete_count": 0,
    "research_coverage_rate": null,
    "context_research_candidate_count": 0,
    "candidate_status_counts": {
      "DISCOVERED": 96
    }
  },
  "timings": {
    "total": null,
    "calendar_check": null,
    "discovery": null,
    "candidate_stage1": null,
    "candidate_stage2": null,
    "source_audit": null,
    "market_validation": null,
    "screening": null,
    "ranking": null
  }
}
